	ID	text	reg_name	sex	titles	titles_norm	titles_ref	titles_ref_norm	prof	prof_norm	staff	staff_norm	off	off_norm	fn_role	event_ref	xml	date	from	to	dead	earliest possible death	year	fromyear	toyear
117	pe__heinrich_senftleben_QGW_II_II_3263	ersamen herren maister Hainreichen Senfftleben, obristen caplan unser fraun capellen gelegen in der burger rathaws hern Otten und Haymen stifftung	Heinrich Senftleben	m	ersamen; herren; maister	 ; Herr; Meister	 	 	 	 	 	 	obristen caplan	 	recipient	ev__SB_CD_00612	00612-eintrag_vom_1448-07-10.xml	1448-07-10			False	 	1448		
118	pe__johann_unverdrossen_SB_CD_00613	Hanns Unverdrossen, helmsmid	Johann Unverdrossen Unverdrossen Helmschmied helmsmid	m	 	 	 	 	helmsmid	 	 	 	 	 	issuer	ev__SB_CD_00613	00613-eintrag_vom_1448-07-17.xml	1448-07-17			False	 	1448		
119	pe__barbara_SB_CD_00613	Barbara, sein hausfrau	Barbara Unverdrossen Unverdrossen	f	 	 	 	 	 	 	 	 	 	 	issuer	ev__SB_CD_00613	00613-eintrag_vom_1448-07-17.xml	1448-07-17			False	 	1448		
120	pe__niklas_vorstl_QGW_II_II_3265	maister Niclasen Vörstl des wuntarczts	Niklas Vorstl der Wundarzt	m	maister	Meister	 	 	wuntarczts	 	 	 	 	 	None	ev__SB_CD_00613	00613-eintrag_vom_1448-07-17.xml	1448-07-17			False	 	1448		
121	pe__georg_schrot_QGW_II_II_3733	hern Jorgen Schrot, pharrer zu Manswerd obristen caplan Sand Peters cappellen und verweser der mess so Eberhart Kasstner pey Peilertor in derselben capellen zu stifften geschafft hat	Georg Schrot	m	hern	Herr	 	 	 	 	 	 	pharrer; obristen caplan; verweser	Pfarrer;  ; Verweser	recipient	ev__SB_CD_00613	00613-eintrag_vom_1448-07-17.xml	1448-07-17			False	 	1448		
122	pe__ulrich_pernauer_SB_CD_00613	Ulreichs Pernawer gurtler	Ulrich Pernauer	m	 	 	 	 	gurtler	 	 	 	 	 	None	ev__SB_CD_00613	00613-eintrag_vom_1448-07-17.xml	1448-07-17			False	 	1448		
123	pe__johann_huber_SB_CD_00613	ersamen herren maister Hannsen Huber, pharrer zu Hindperg, caplan Gotsleichnams altar under dem newen turren dacz Sand Michel der von Eslorn stifftung	Johann Huber	m	ersamen; herren; maister	 ; Herr; Meister	 	 	 	 	 	 	pharrer; caplan	Pfarrer; Kaplan	recipient	ev__SB_CD_00613	00613-eintrag_vom_1448-07-17.xml	1448-07-17			False	 	1448		
124	pe__johann_wuerer_QGW_II_II_2993	Hanns Wurer, vorsprech	Johann Würer	m	 	 	 	 	 	 	 	 	vorsprech	Vorsprech	issuer	ev__SB_CD_00614	00614-eintrag_vom_1448-07-29.xml	1448-07-29			False	 	1448		
125	pe__liebhard_weiss_SB_CD_00606	Liepharts Weissen	Liebhard Weiss	m	 	 	 	 	 	 	 	 	 	 	None	ev__SB_CD_00614	00614-eintrag_vom_1448-07-29.xml	1448-07-29			False	 	1448		
126	pe__heinrich_teufl_SB_CD_00614	erbern Hainreichen Tewffl, burger am Lauffen	Heinrich Teufl Tewffl	m	erbern	ehrbar	 	 	 	 	 	 	 	 	recipient	ev__SB_CD_00614	00614-eintrag_vom_1448-07-29.xml	1448-07-29			False	 	1448		
127	pe__johann_hinlauf_SB_CD_00616	Hanns Hinlauf	Johann Hinlauf Hinlauf	m	 	 	 	 	 	 	 	 	 	 	issuer	ev__SB_CD_00616	00616-eintrag_vom_1448-07-19.xml	1448-07-19			False	 	1448		
128	pe__agnes_SB_CD_00616	Agnes, sein hausfrau	Agnes Hinlauf Hinlauf	f	 	 	 	 	 	 	 	 	 	 	issuer	ev__SB_CD_00616	00616-eintrag_vom_1448-07-19.xml	1448-07-19			False	 	1448		
129	pe__georg_vom_ror_QGW_II_II_3714	hern Jorgen vom Ror	Georg vom Ror der Fleischacker	m	hern	Herr	 	 	 	 	 	 	 	 	None	ev__SB_CD_00616	00616-eintrag_vom_1448-07-19.xml	1448-07-19			False	 	1448		
130	pe__thomas_hadmar_SB_CD_00616	erwirdigen herren hern Thoman Hadmarn, techant dacz Sand Steffan zu Wienn, dieczeit kaplan Sand Achaczen cappellen auf dem Freithof daselbs gelegen	Thomas Hadmar	m	erwirdigen; herren; hern	 ; Herr; Herr	 	 	 	 	 	 	techant; kaplan	 ; Kaplan	recipient	ev__SB_CD_00616	00616-eintrag_vom_1448-07-19.xml	1448-07-19			False	 	1448		
131	pe__johann_schuchl_SB_CD_00617	Hanns Schúchl, goltsmid	Johann Schuchl der Goldschmied	m	 	 	 	 	goltsmid	Goldschmied	 	 	 	 	issuer	ev__SB_CD_00617	00617-eintrag_vom_1448-08-26.xml	1448-08-26			False	 	1448		
132	pe__ulrich_fochter_QGW_II_II_3228	Ulreichs Vochter sneider	Ulrich Fochter	m	 	 	 	 	sneider	Schneider	 	 	 	 	None	ev__SB_CD_00617	00617-eintrag_vom_1448-08-26.xml	1448-08-26			False	 	1448		
133	pe__johann_han_SB_CD_00617	erbern maister Hannsen Han, puchsenmaister	Johann Han der Büchsenmeister puchsenmeister	m	erbern; maister	ehrbar; Meister	 	 	puchsenmaister	 	 	 	 	 	recipient	ev__SB_CD_00617	00617-eintrag_vom_1448-08-26.xml	1448-08-26			False	 	1448		
134	pe__barbara_SB_CD_00617	Barbaren, seiner hausfraun	Barabara Han	f	 	 	 	 	 	 	 	 	 	 	recipient	ev__SB_CD_00617	00617-eintrag_vom_1448-08-26.xml	1448-08-26			False	 	1448		
135	pe__heinrich_eschlbach_SB_CD_00618	Hainrich Eschlbach, der brunner	Heinrich Eschlbach Eschlbach der brunner	m	 	 	 	 	brunner	Bruenner	 	 	 	 	issuer	ev__SB_CD_00618	00618-eintrag_vom_1448-09-02.xml	1448-09-02			False	 	1448		
136	pe__margarethe_SB_CD_00618	Margreth, sein hausfrau	Margarethe Eschlbach	f	 	 	 	 	 	 	 	 	 	 	issuer	ev__SB_CD_00618	00618-eintrag_vom_1448-09-02.xml	1448-09-02			False	 	1448		
137	pe__friedrich_koch_SB_CD_00618	Fridreichs kochs	Friedrich Koch der Koch	m	 	 	 	 	kochs	 	 	 	 	 	None	ev__SB_CD_00618	00618-eintrag_vom_1448-09-02.xml	1448-09-02			False	 	1448		
138	pe__georg_brunntaler_SB_CD_00618	erbern Jorgen Bruntaler, kirchmaister zu Sand Michel	Georg Brunntaler	m	erbern	ehrbar	 	 	 	 	 	 	kirchmaister	 	recipient	ev__SB_CD_00618	00618-eintrag_vom_1448-09-02.xml	1448-09-02			False	 	1448		
139	pe__heinrich_eschlbach_SB_CD_00618	Hainreich Eschlbach, der brunner	Heinrich Eschlbach Eschlbach der brunner	m	 	 	 	 	brunner	Bruenner	 	 	 	 	issuer	 	00619-eintrag_vom_1448-09-04.xml	1448-09-04			False	 	1448		
140	pe__margarethe_SB_CD_00618	Margreth, sein hausfrau	Margarethe Eschlbach	f	 	 	 	 	 	 	 	 	 	 	issuer	 	00619-eintrag_vom_1448-09-04.xml	1448-09-04			False	 	1448		
141	pe__johann_unverdrossen_SB_CD_00619	Hannsen Unverdrossen des plattner	Johann Unverdrossen Unverdrossen der Plattner der plattner	m	 	 	 	 	plattner	Plattner	 	 	 	 	None	 	00619-eintrag_vom_1448-09-04.xml	1448-09-04			False	 	1448		
142	pe__leonhard_von_stein_SB_CD_00619	ersamen herren maister Linharten von Stain, dieczeit caplan der ewigen messe die weilent der Lorberer auf Sand Jacobs altar in Sand Michels kirchen zu Wienn gestifft hat	Leonhard von Stein	m	ersamen; herren; maister	 ; Herr; Meister	 	 	 	 	 	 	caplan	Kaplan	recipient	 	00619-eintrag_vom_1448-09-04.xml	1448-09-04			False	 	1448		
143	pe__johann_kieler_SB_CD_00620	Hanns Kieler	Johann Kieler Chieler	m	 	 	 	 	 	 	 	 	 	 	issuer	ev__SB_CD_00620	00620-eintrag_vom_1448-11-20.xml	1448-11-20			False	 	1448		
144	pe__ulrich_floederl_QGW_II_II_3238	Ulreichs Floderl slosser	Ulrich Flöderl der Schlosser	m	 	 	 	 	slosser	Schlosser	 	 	 	 	None	ev__SB_CD_00620	00620-eintrag_vom_1448-11-20.xml	1448-11-20			False	 	1448		
145	pe__barbara_SB_CD_00620	hausfraun Barbaren	Barbara Kielerin Neugrunerin Kanstorfferin	f	 	 	 	 	 	 	 	 	 	 	recipient	ev__SB_CD_00620	00620-eintrag_vom_1448-11-20.xml	1448-11-20			False	 	1448		
146	pe__niklas_neugruener_SB_CD_00620	Niclasen des Newgruner seligen	Niklas Neugrüner	m	 	 	 	 	 	 	 	 	 	 	recipient	ev__SB_CD_00620	00620-eintrag_vom_1448-11-20.xml	1448-11-20			True	1448-11-20	1448		
147	pe__johann_hermann_SB_CD_00621	Hanns Herman	Johann Hermann	m	 	 	 	 	 	 	 	 	 	 	issuer	ev__SB_CD_00621	00621-eintrag_vom_1448-11-27.xml	1448-11-27			False	 	1448		
148	pe__johann_ungerland_SB_CD_00621	erbern Hannsen Ungerlandt, erhalt des kunigkreichs zu Ungern	Johann Ungerland	m	erbern	ehrbar	 	 	 	 	 	 	erhalt	 	recipient	ev__SB_CD_00621	00621-eintrag_vom_1448-11-27.xml	1448-11-27			False	 	1448		
149	pe__johann_zuchtig_SB_CD_00622	Züchtig Hanns	Johann Zuchtig	m	 	 	 	 	 	 	 	 	 	 	issuer	ev__SB_CD_00622	00622-eintrag_vom_1448-12-09.xml	1448-12-09			False	 	1448		
150	pe__jakob_rechwein_QGW_II_II_3242	Jacoben des Rechwein	Jakob Rechwein	m	 	 	 	 	 	 	 	 	 	 	None	ev__SB_CD_00622	00622-eintrag_vom_1448-12-09.xml	1448-12-09			False	 	1448		
151	pe__niklas_krotendorfer_SB_CD_00622	ersamen herren maister Niclasen Krotendorffer	Niklas Krotendorffer	m	ersamen; herren; maister	 ; Herr; Meister	 	 	 	 	 	 	 	 	recipient	ev__SB_CD_00622	00622-eintrag_vom_1448-12-09.xml	1448-12-09			False	 	1448		
152	pe__johann_frey_SB_CD_00623	Hanns Frey, parhander	Johann Frey der parhander	m	 	 	 	 	parhander	 	 	 	 	 	issuer	ev__SB_CD_00623	00623-eintrag_vom_1448-12-13.xml	1448-12-13			False	 	1448		
153	pe__johann_hoephl_SB_CD_00618	Hannsen Höphl	Johann Höphl	m	 	 	 	 	 	 	 	 	 	 	None	ev__SB_CD_00623	00623-eintrag_vom_1448-12-13.xml	1448-12-13			False	 	1448		
154	pe__johann_meczinger_SB_CD_00623	hern Hannsen Méczinger, caplan der mess so Dietreich Fluschart auf unser fraun altar zu Sand Steffan gestifft hat	Johann Meczinger	m	hern	Herr	 	 	 	 	 	 	caplan	Kaplan	recipient	ev__SB_CD_00623	00623-eintrag_vom_1448-12-13.xml	1448-12-13			False	 	1448		
155	pe__dietrich_flusthart_SB_CD_00623	Dietreich Fluschart	Dietrich Flusthart Flusthart	m	 	 	 	 	 	 	 	 	 	 	issuer	ev__SB_CD_00623	00623-eintrag_vom_1448-12-13.xml	1448-12-13			False	 	1448		
156	pe__johann_weilhaimer_SB_CD_00626	Hanns Weilhaimer, goltslaher	Johann Weilhaimer der goltslaher	m	 	 	 	 	goltslaher	Goldschmied	 	 	 	 	issuer	ev__SB_CD_00624	00624-eintrag_vom_1448-09-23.xml	1448-09-23			False	 	1448		
157	pe__johann_strempfl_QGW_II_II_3276	Hannsen Stremphl	Johann Stremphl	m	 	 	 	 	 	 	 	 	 	 	None	ev__SB_CD_00624	00624-eintrag_vom_1448-09-23.xml	1448-09-23			False	 	1448		
158	pe__stephan_sorgenfrey_SB_CD_00624	Steffans Sorgenfrey des huter	Stephan Sorgenfrey der Huter	m	 	 	 	 	huter	 	 	 	 	 	None	ev__SB_CD_00624	00624-eintrag_vom_1448-09-23.xml	1448-09-23			False	 	1448		
159	pe__christian_widhacker_SB_CD_00626	hern Kristan dem Widhakcher, kaplan der mess die Hainreich Purkchartsperger dacz Sand Steffan gestifft hat	Christian Widhacker	m	hern	Herr	 	 	 	 	 	 	kaplan	Kaplan	recipient	ev__SB_CD_00624	00624-eintrag_vom_1448-09-23.xml	1448-09-23			False	 	1448		
160	pe__heinrich_purkchartsperger_QGW_II_I_1560	Hainreich Purkchartsperger	Heinrich Purkchartsperger	m	 	 	 	 	 	 	 	 	 	 	issuer	ev__SB_CD_00624	00624-eintrag_vom_1448-09-23.xml	1448-09-23			False	 	1448		
161	pe__johann_hermann_SB_CD_00621	Hanns Herman	Johann Hermann	m	 	 	 	 	 	 	 	 	 	 	issuer	ev__SB_CD_00625	00625-eintrag_vom_1448-12-11.xml	1448-12-11			False	 	1448		
162	pe__georg_von_nikolsburg_QGW_II_II_2373	Jörgen von Nicolspurg	Georg von Nikolsburg	m	 	 	 	 	 	 	 	 	 	 	None	ev__SB_CD_00625	00625-eintrag_vom_1448-12-11.xml	1448-12-11			False	 	1448		
163	pe__ulrich_von_steyr_SB_CD_00625	weilent Ulreichs von Steir	Ulrich von Steyr	m	 	 	 	 	 	 	 	 	 	 	None	ev__SB_CD_00625	00625-eintrag_vom_1448-12-11.xml	1448-12-11			True	1448-06-23	1448		
164	pe__katharina_SB_CD_00625	erbern Kathrein, seiner hausfraun	Katharina Hermann	f	erbern	ehrbar	 	 	 	 	 	 	 	 	recipient	ev__SB_CD_00625	00625-eintrag_vom_1448-12-11.xml	1448-12-11			False	 	1448		
165	pe__johann_weilhaimer_SB_CD_00626	Hanns Weilhaimer, der goltslaher	Johann Weilhaimer der goltslaher	m	 	 	 	 	goltslaher	Goldschmied	 	 	 	 	issuer	ev__SB_CD_00626	00626-eintrag_vom_1448-12-20.xml	1448-12-20			False	 	1448		
166	pe__heinrich_maler_SB_CD_00626	Hainreichs Maler	Heinrich Maler	m	 	 	 	 	 	 	 	 	 	 	None	ev__SB_CD_00626	00626-eintrag_vom_1448-12-20.xml	1448-12-20			False	 	1448		
167	pe__lorenz_swarcz_SB_CD_00626	Larenczen Swarcz	Lorenz Swarcz	m	 	 	 	 	 	 	 	 	 	 	None	ev__SB_CD_00626	00626-eintrag_vom_1448-12-20.xml	1448-12-20			False	 	1448		
168	pe__johann_von_waetsch_SB_CD_00626	her Hannsen von Wätsch, kaplan der messe die her Kunrat pfarrer zu Rakerspurg auf Sant Jorgen und Sand Erasms altar in Sant Michls pfarrkirchen gestifft hat	Johann von Wätsch	m	her	Herr	 	 	 	 	 	 	kaplan	Kaplan	recipient	ev__SB_CD_00626	00626-eintrag_vom_1448-12-20.xml	1448-12-20			False	 	1448		
169	pe__konrad_SB_CD_00626	her Kunrat pfarrer zu Rakerspurg	Konrad	m	her	Herr	 	 	 	 	 	 	pfarrer	Pfarrer	issuer	ev__SB_CD_00626	00626-eintrag_vom_1448-12-20.xml	1448-12-20			False	 	1448		
170	pe__heinrich_wurm_SB_CD_00627	Hainreich Wurm, pekch	Heinrich Wurm der pekch	m	 	 	 	 	pekch	Baecker	 	 	 	 	issuer	ev__SB_CD_00627	00627-eintrag_vom_1448-12-20.xml	1448-12-20			False	 	1448		
171	pe__simon_lempl_QGW_II_II_4131	erbern Symon Lémpl pekchen geschefftleuten zu handen zu handen zu handen	Simon Lempl der pekch	m	erbern	ehrbar	geschefftleuten; zu handen; zu handen; zu handen	 ;  ;  ;  	pekchen	Baecker	 	 	 	 	recipient	ev__SB_CD_00627	00627-eintrag_vom_1448-12-20.xml	1448-12-20			False	 	1448		
172	pe__wilhelm_von_freising_QGW_II_II_4106	erbern Wilhalmen von Freising pekchen geschefftleuten zu handen zu handen zu handen	Wilhelm von Freising der pekch	m	erbern	ehrbar	geschefftleuten; zu handen; zu handen; zu handen	 ;  ;  ;  	pekchen	Baecker	 	 	 	 	recipient	ev__SB_CD_00627	00627-eintrag_vom_1448-12-20.xml	1448-12-20			False	 	1448		
173	pe__niklas_pehem_SB_CD_00627	erbern Niclasen Pehem, den pekchen Erharts Smidpekchen seligen geschefftleuten zu handen zu handen zu handen	Niklas Pehem der pekch	m	erbern	ehrbar	geschefftleuten; zu handen; zu handen; zu handen	 ;  ;  ;  	pekchen	Baecker	 	 	 	 	recipient	ev__SB_CD_00627	00627-eintrag_vom_1448-12-20.xml	1448-12-20			False	 	1448		
174	pe__erhard_smidpekch_QGW_II_II_3043	Erharts Smidpekchen seligen	Erhard Smidpekch	m	 	 	 	 	 	 	 	 	 	 	None	ev__SB_CD_00627	00627-eintrag_vom_1448-12-20.xml	1448-12-20			True	1448-12-20	1448		
175	pe__heinrich_smidpekch_SB_CD_00627	Hainreichen kinder	Heinrich Smidpekch	m	 	 	 	 	 	 	 	 	 	 	None	ev__SB_CD_00627	00627-eintrag_vom_1448-12-20.xml	1448-12-20			False	 	1448		
176	pe__margarethe_SB_CD_00627	Margrethen kinder	Margarethe Smidpekch	f	 	 	 	 	 	 	 	 	 	 	None	ev__SB_CD_00627	00627-eintrag_vom_1448-12-20.xml	1448-12-20			False	 	1448		
177	pe__anna_QGW_II_II_3679	Annen, desselben Smidpekchen kinder	Anna Smidpekch	f	 	 	 	 	 	 	 	 	 	 	None	ev__SB_CD_00627	00627-eintrag_vom_1448-12-20.xml	1448-12-20			False	 	1448		
178	pe__georg_krumpp_SB_CD_00966	Jorg Krumpp, der pinter	Georg Krumpp der Binder	m	 	 	 	 	pinter	Binder	 	 	 	 	issuer	ev__SB_CD_00966	00966-eintrag_vom_1448-06-07.xml	1448-06-07			False	 	1448		
179	pe__wolfgang_von_hallstadt_SB_CD_00966	hern Wolfgangen von Hallstat, capplan der mezz so fraw Dorothe die Poschin auf Sand Blasien altar zu Sant Steffan gestifft hat	Wolfgang von Hallstadt	m	hern	Herr	 	 	 	 	 	 	capplan	 	recipient	ev__SB_CD_00966	00966-eintrag_vom_1448-06-07.xml	1448-06-07			False	 	1448		
180	pe__dorothea_poschin_SB_CD_00966	fraw Dorothe die Poschin	Dorothea Posch Poschin	f	fraw	Frau	 	 	 	 	 	 	 	 	None	ev__SB_CD_00966	00966-eintrag_vom_1448-06-07.xml	1448-06-07			False	 	1448		
181	pe__thomas_swarcz_QGW_II_II_2673	erbern weisen Thomanen Swartz, spitalmaister der burgerspital	Thomas Swarcz	m	erbern; weisen	ehrbar; weise	 	 	 	 	 	 	spitalmaister	Spitalmeister	recipient	ev__SB_CD_00966	00966-eintrag_vom_1448-06-07.xml	1448-06-07			False	 	1448		
182	pe__jakob_straiffing_QGW_II_III_2360	Jacob Straiffing	Jakob Straiffing der Zinngiesser	m	 	 	 	 	 	 	 	 	 	 	issuer	ev__SB_CD_00968	00968-eintrag_vom_1448-07-10.xml	1448-07-10			False	 	1448		
183	pe__peter_obrecht_QGW_II_III_2464	Peter Obrecht, zingiesser	Peter Obrecht der Zinngiesser	m	 	 	 	 	zingiesser	Zinngiesser	 	 	 	 	issuer	ev__SB_CD_00968	00968-eintrag_vom_1448-07-10.xml	1448-07-10			False	 	1448		
184	pe__erhard_neunkircher_QGW_II_II_3274	maister Erharts Newnkircher des glokengiesser	Erhard Neunkircher der Glockengießer	m	maister	Meister	 	 	glokengiesser	 	 	 	 	 	None	ev__SB_CD_00968	00968-eintrag_vom_1448-07-10.xml	1448-07-10			False	1448-09-13	1448		
185	pe__heinrich_stoll_SB_CD_00968	Hainrich Stolln des pekchen	Heinrich Stoll der pekch	m	 	 	 	 	pekchen	Baecker	 	 	 	 	None	ev__SB_CD_00968	00968-eintrag_vom_1448-07-10.xml	1448-07-10			False	 	1448		
186	pe__dorothea_SB_CD_00968	erbern fraun Dorothen, Hannsen Veder des gurtler hausfrawn die emalen den benanten maister Erharten seligen auch emalen elichen gehabt hat	Dorothea Veder Neunkirchner	f	erbern; fraun	ehrbar; Frau	 	 	 	 	 	 	 	 	recipient	ev__SB_CD_00968	00968-eintrag_vom_1448-07-10.xml	1448-07-10			False	 	1448		
187	pe__johann_veder_SB_CD_00968	Hannsen Veder des gurtler	Johann Veder der Gürtler	m	 	 	 	 	gurtler	 	 	 	 	 	None	ev__SB_CD_00968	00968-eintrag_vom_1448-07-10.xml	1448-07-10			False	 	1448		
188	pe__georg_zwettler_QGW_II_II_2927	Jorg Zwetler, eysenczieher hinder Sand Pangreczen	Georg Zwettler der Eisenzieher hinter St. Pankraz	m	 	 	 	 	eysenczieher	 	 	 	 	 	issuer	ev__SB_CD_00969	00969-eintrag_vom_1448-10-30.xml	1448-10-30			False	 	1448		
189	pe__elisabeth_SB_CD_00969	Elsbet sein hausfraw	Elisabeth Zwettler	f	 	 	 	 	 	 	 	 	 	 	issuer	ev__SB_CD_00969	00969-eintrag_vom_1448-10-30.xml	1448-10-30			False	 	1448		
190	pe__michael_hiltprant_QGW_II_II_2417	Hiltprants des smids	Michael Hiltprant der Schmied	m	 	 	 	 	smids	 	 	 	 	 	None	ev__SB_CD_00969	00969-eintrag_vom_1448-10-30.xml	1448-10-30			False	 	1448		
191	pe__lorenz_rat_SB_CD_00969	erbern herren herren Larenczen Rat, kaplan der mezz die Hanns Reichel hinder Sant Pangréczn auf dem letter zu Sand Michel gestifft hat	Lorenz Rat	m	erbern; herren; herren	ehrbar; Herr; Herr	 	 	 	 	 	 	kaplan	Kaplan	recipient	ev__SB_CD_00969	00969-eintrag_vom_1448-10-30.xml	1448-10-30			False	 	1448		
192	pe__johann_reichl_SB_CD_00969	Hanns Reichel hinder Sant Pangréczn	Johann Reichl hinter St. Pankraz	m	 	 	 	 	 	 	 	 	 	 	issuer	ev__SB_CD_00969	00969-eintrag_vom_1448-10-30.xml	1448-10-30			False	 	1448		
193	pe__jakob_schutwempl_SB_CD_00970	Jacob Schutwémpl, vastzieher	Jakob Schutwémpl der Fasszieher	m	 	 	 	 	vastzieher	 	 	 	 	 	issuer	ev__SB_CD_00970	00970-eintrag_vom_1448-11-20.xml	1448-11-20			False	 	1448		
194	pe__peter_von_aspern_SB_CD_00970	hern Petern von Asparn	Peter von Aspern	m	hern	Herr	 	 	 	 	 	 	 	 	None	ev__SB_CD_00970	00970-eintrag_vom_1448-11-20.xml	1448-11-20			False	 	1448		
195	pe__kaspar_SB_CD_00970	erbern herren herren Kasparn, dieczeit cantor zu Sand Steffan zu Wienn	Kaspar	m	erbern; herren; herren	ehrbar; Herr; Herr	 	 	 	 	 	 	cantor	Kantor	recipient	ev__SB_CD_00970	00970-eintrag_vom_1448-11-20.xml	1448-11-20			False	 	1448		
196	pe__georg_muenich_QGW_II_II_3410	Jorg	Georg Münich	m	 	 	 	 	 	 	 	 	 	 	issuer	ev__SB_CD_00971	00971-eintrag_vom_1448-12-16.xml	1448-12-16			False	 	1448		
197	pe__jakob_muenich_QGW_II_II_3410	Jacob, gepruder die Münich	Jakob Münich	m	 	 	 	 	 	 	 	 	 	 	issuer	ev__SB_CD_00971	00971-eintrag_vom_1448-12-16.xml	1448-12-16			False	 	1448		
198	pe__peter_von_nussdorf_QGW_II_II_2963	Petern von Nusdorf des sneider	Peter von Nussdorf der Schneider	m	 	 	 	 	sneider	Schneider	 	 	 	 	None	ev__SB_CD_00971	00971-eintrag_vom_1448-12-16.xml	1448-12-16			False	 	1448		
199	pe__matthias_seirer_SB_CD_00971	hern Mathesen Seirer, caplan der messe die Hainreich Kessler auf allerheiligen altar zu Sant Steffan gestifft hat	Matthias Seirer	m	hern	Herr	 	 	 	 	 	 	caplan	Kaplan	recipient	ev__SB_CD_00971	00971-eintrag_vom_1448-12-16.xml	1448-12-16			False	 	1448		
200	pe__heinrich_chessler_SB_CD_00971	Hainreich Kessler	Heinrich Chessler	m	 	 	 	 	 	 	 	 	 	 	issuer	ev__SB_CD_00971	00971-eintrag_vom_1448-12-16.xml	1448-12-16			False	 	1448		
201	pe__kunigunde_QGW_II_III_4053	Kunigund, Hannsen des Hagen seligen witib	Kunigunde Hagen	f	 	 	 	 	 	 	 	 	 	 	issuer	ev__SB_CD_01099	01099-eintrag_vom_1448-02-20.xml	1448-02-20			False	 	1448		
202	pe__johann_hagen_QGW_II_III_4053	Hannsen des Hagen seligen	Johann Hagen	m	 	 	 	 	 	 	 	 	 	 	None	ev__SB_CD_01099	01099-eintrag_vom_1448-02-20.xml	1448-02-20			True	1448-02-20	1448		
203	pe__johann_kollendorffer_SB_CD_01099	erbern Hannsen Kollendorffer	Johann Kollendorffer	m	erbern	ehrbar	 	 	 	 	 	 	 	 	recipient	ev__SB_CD_01099	01099-eintrag_vom_1448-02-20.xml	1448-02-20			False	 	1448		
204	pe__anna_SB_CD_01099	tochtern junkfraun Annen	Anna Kollendorffer	f	 	 	 	 	 	 	 	 	 	 	recipient	ev__SB_CD_01099	01099-eintrag_vom_1448-02-20.xml	1448-02-20			False	 	1448		
205	pe__klara_SB_CD_01099	tochtern Klarn	Klara Kollendorffer	f	 	 	 	 	 	 	 	 	 	 	recipient	ev__SB_CD_01099	01099-eintrag_vom_1448-02-20.xml	1448-02-20			False	 	1448		
206	pe__dorothea_SB_CD_01099	tochtern Dorothen	Dorothea Kollendorffer	f	 	 	 	 	 	 	 	 	 	 	recipient	ev__SB_CD_01099	01099-eintrag_vom_1448-02-20.xml	1448-02-20			False	 	1448		
207	pe__kunigunde_SB_CD_01099	tochtern Kunigunden	Kunigunde Kollendorffer	f	 	 	 	 	 	 	 	 	 	 	recipient	ev__SB_CD_01099	01099-eintrag_vom_1448-02-20.xml	1448-02-20			False	 	1448		
208	pe__katharina_SB_CD_01100	Kathrey, Wentzlaben Grat des schuster hausfrau	Katharina Grat	f	 	 	 	 	 	 	 	 	 	 	issuer	ev__SB_CD_01100	01100-eintrag_vom_1448-04-29.xml	1448-04-29			False	 	1448		
209	pe__wenzel_grat_QGW_II_III_4253	Wentzlaben Grat des schuster	Wenzel Grat der Schuster	m	 	 	 	 	schuster	Schuster	 	 	 	 	None	ev__SB_CD_01100	01100-eintrag_vom_1448-04-29.xml	1448-04-29			False	 	1448		
210	pe__niklas_saur_SB_CD_01100	Niclasen Sawr schuster	Niklas Saur der Schuster	m	 	 	 	 	schuster	Schuster	 	 	 	 	None	ev__SB_CD_01100	01100-eintrag_vom_1448-04-29.xml	1448-04-29			False	 	1448		
211	pe__erasmus_vinkch_QGW_II_II_3328	erbern Erasm Vinkch schustern anstat und zuhanden	Erasmus Vinkch der Schuster	m	erbern	ehrbar	anstat und zuhanden	rechtlicher_Vertreter_in	schustern	 	 	 	 	 	recipient	ev__SB_CD_01100	01100-eintrag_vom_1448-04-29.xml	1448-04-29			False	 	1448		
212	pe__matthias_kuntschikch_SB_CD_01100	erbern Mathesen Kuntschikch, den schustern anstat und zuhanden	Matthias Kuntschikch der Schuster	m	erbern	ehrbar	anstat und zuhanden	rechtlicher_Vertreter_in	schustern	 	 	 	 	 	recipient	ev__SB_CD_01100	01100-eintrag_vom_1448-04-29.xml	1448-04-29			False	 	1448		
213	pe__anna_SB_CD_01100	junkfraun Annen, Hainrichen Unverdrossen des schuster seligen tochter	Anna Unverdrossen Unverdrossen	f	 	 	 	 	 	 	 	 	 	 	None	ev__SB_CD_01100	01100-eintrag_vom_1448-04-29.xml	1448-04-29			False	 	1448		
214	pe__heinrich_unverdrossen_SB_CD_01100	Hainrichen Unverdrossen des schuster seligen	Heinrich Unverdrossen Unverdrossen Helmschied helmsmid	m	 	 	 	 	schuster	Schuster	 	 	 	 	None	ev__SB_CD_01100	01100-eintrag_vom_1448-04-29.xml	1448-04-29			True	1448-04-29	1448		
215	pe__leonhard_gruenpacher_QGW_II_II_2953	Lienhart Grúnpacher	Leonhard Grünpacher	m	 	 	 	 	 	 	 	 	 	 	issuer	ev__SB_CD_01146	01146-eintrag_vom_1448-04-12.xml	1448-04-12			False	 	1448		
216	pe__leonhard_gruenpacher_QGW_II_II_2953	er	Leonhard Grünpacher	m	 	 	 	 	 	 	 	 	 	 	issuer	ev__SB_CD_01146	01146-eintrag_vom_1448-04-12.xml	1448-04-12			False	 	1448		
217	pe__anna_QGW_II_II_2953	seiner hausfraun Annen	Anna Grünpacher	f	 	 	 	 	 	 	 	 	 	 	recipient	ev__SB_CD_01146	01146-eintrag_vom_1448-04-12.xml	1448-04-12			False	 	1448		
218	pe__johann_von_maires_QGW_II_II_3818	ersamen herren maister Hannsen von Meirs, tumbherren zu Passaw pharrer zu Gars und kanczler anstat und als geschefftherren und als geschefftherren	Johann von Maires	m	ersamen; herren; maister	 ; Herr; Meister	anstat; und als geschefftherren; und als geschefftherren	rechtlicher_Vertreter_in;  ;  	 	 	 	 	pharrer; kanczler	Pfarrer;  	recipient	ev__SB_CD_01146	01146-eintrag_vom_1448-04-12.xml	1448-04-12			False	 	1448		
219	pe__niklas_ernst_SB_CD_01146	erbern Niclasen Ernst, burger zu Wienn, anstat und als geschefftherren und als geschefftherren	Niklas Ernst	m	erbern	ehrbar	anstat; und als geschefftherren; und als geschefftherren	rechtlicher_Vertreter_in;  ;  	 	 	 	 	 	 	recipient	ev__SB_CD_01146	01146-eintrag_vom_1448-04-12.xml	1448-04-12			False	 	1448		
220	pe__katharina_QGW_II_II_3482a	junkfraun Kathrein, Ulreichs Phanczagl seligen und Barbaren seiner hausfraun seligen tochter tochter , die noch nicht vogtper ist	Katharina Phanczaglin	f	 	 	 	 	 	 	 	 	 	 	None	ev__SB_CD_01146	01146-eintrag_vom_1448-04-12.xml	1448-04-12			False	 	1448		
221	pe__ulrich_phanczagl_QGW_II_II_2630	Ulreichs Phanczagl seligen	Ulrich Phanczagl	m	 	 	 	 	 	 	 	 	 	 	None	ev__SB_CD_01146	01146-eintrag_vom_1448-04-12.xml	1448-04-12			True	1448-04-12	1448		
222	pe__barbara_QGW_II_II_3482a	Barbaren seiner hausfraun seligen	Barbara Phanczaglin	f	 	 	 	 	 	 	 	 	 	 	None	ev__SB_CD_01146	01146-eintrag_vom_1448-04-12.xml	1448-04-12			True	1448-04-12	1448		
223	pe__lorenz_krakauer_SB_CD_01147	Larencz Krakawer, helmsmid	Lorenz Krakauer der Helmschmied	m	 	 	 	 	helmsmid	 	 	 	 	 	issuer	ev__SB_CD_01147	01147-eintrag_vom_1448-04-29.xml	1448-04-29			False	 	1448		
224	pe__johann_peinhekchel_QGW_II_II_3111	Hannsen Painhékchl des Brúnner	Johann Peinhekchl der Brunner	m	 	 	 	 	Brúnner	 	 	 	 	 	None	ev__SB_CD_01147	01147-eintrag_vom_1448-04-29.xml	1448-04-29			False	 	1448		
225	pe__georg_brunntaler_SB_CD_00618	erbern weisen Jorgen Bruntaler, kirchmaister Sand Michels kirchen, und seinen nachkomen	Georg Brunntaler	m	erbern; weisen	ehrbar; weise	 	 	 	 	 	 	kirchmaister	 	recipient	ev__SB_CD_01147	01147-eintrag_vom_1448-04-29.xml	1448-04-29			False	 	1448		
226	pe__leonhard_kriech_QGW_II_II_3126	Lienhart Kriech, Hannsen Kriechen des kursner seligen sun	Leonhard Kriech	m	 	 	 	 	 	 	 	 	 	 	issuer	ev__SB_CD_01148	01148-eintrag_vom_1448-05-17.xml	1448-05-17			False	 	1448		
227	pe__johann_kriech_QGW_II_II_3126	Hannsen Kriechen des kursner seligen	Johann Kriech	m	 	 	 	 	kursner	Kuerschner	 	 	 	 	None	ev__SB_CD_01148	01148-eintrag_vom_1448-05-17.xml	1448-05-17			True	1448-05-17	1448		
228	pe__martin_wachsgiesser_QGW_II_I_1494	Martine des Wachsgiesser	Martin der Wachsgiesser	m	 	 	 	 	Wachsgiesser	Wachsgiesser	 	 	 	 	None	ev__SB_CD_01148	01148-eintrag_vom_1448-05-17.xml	1448-05-17			False	 	1448		
229	pe__elisabeth_SB_CD_01148	edeln fraun Elspethen, Wolfgangen des Réwtter seligen witiben	Elisabeth Reuter	f	edeln; fraun	edel; Frau	 	 	 	 	 	 	 	 	recipient	ev__SB_CD_01148	01148-eintrag_vom_1448-05-17.xml	1448-05-17			False	 	1448		
